{
  "$schema": "../schemas/fusion-drive.schema.json",
  "schema_version": 2,
  "active_profile": "xai-claude-oauth",
  "providers": {
    "xai_api": {
      "enabled": true,
      "transport": "xai_responses",
      "base_url": "https://api.x.ai/v1",
      "auth": {
        "mode": "api_key_env",
        "api_key_env": "XAI_API_KEY"
      },
      "billing": "metered_api",
      "max_concurrency": 2,
      "request_timeout_seconds": 900,
      "max_retries": 2,
      "async_batch": {
        "supported": false,
        "models": [],
        "reason": "The xAI Batch API rejects grok-4.5; use bounded microbatching and prompt caching instead."
      }
    },
    "openrouter_api": {
      "enabled": false,
      "transport": "openrouter_chat",
      "base_url": "https://openrouter.ai/api/v1",
      "auth": {
        "mode": "api_key_env",
        "api_key_env": "OPENROUTER_API_KEY"
      },
      "billing": "metered_api",
      "max_concurrency": 3,
      "request_timeout_seconds": 1200,
      "max_retries": 2,
      "async_batch": {
        "supported": false,
        "models": [],
        "reason": "No general asynchronous completion Batch API is documented; use bounded microbatching and provider caching."
      }
    },
    "openrouter_fusion_api": {
      "enabled": false,
      "transport": "openrouter_fusion",
      "base_url": "https://openrouter.ai/api/v1",
      "auth": {
        "mode": "api_key_env",
        "api_key_env": "OPENROUTER_API_KEY"
      },
      "billing": "metered_api",
      "max_concurrency": 1,
      "request_timeout_seconds": 1800,
      "max_retries": 1,
      "async_batch": {
        "supported": false,
        "models": [],
        "reason": "Fusion is one server-managed fan-out request, not a provider batch job."
      }
    },
    "openai_api": {
      "enabled": true,
      "transport": "openai_responses",
      "base_url": "https://api.openai.com/v1",
      "auth": {
        "mode": "api_key_env",
        "api_key_env": "OPENAI_API_KEY"
      },
      "billing": "metered_api",
      "max_concurrency": 2,
      "request_timeout_seconds": 900,
      "max_retries": 2,
      "async_batch": {
        "supported": true,
        "endpoint": "/v1/responses",
        "completion_window": "24h",
        "discount_claim": "provider_documented_50_percent"
      }
    },
    "anthropic_api": {
      "enabled": false,
      "transport": "anthropic_messages",
      "base_url": "https://api.anthropic.com/v1",
      "auth": {
        "mode": "api_key_env",
        "api_key_env": "ANTHROPIC_API_KEY"
      },
      "billing": "metered_api",
      "max_concurrency": 2,
      "request_timeout_seconds": 900,
      "max_retries": 2,
      "async_batch": {
        "supported": true,
        "endpoint": "/v1/messages/batches",
        "completion_window": "provider_managed",
        "discount_claim": "provider_documented_50_percent"
      }
    },
    "grok_oauth": {
      "enabled": true,
      "transport": "grok_cli_oauth",
      "command": "grok",
      "auth": {
        "mode": "cli_oauth_keychain",
        "api_key_env": "XAI_API_KEY"
      },
      "billing": "subscription",
      "allocated_subscription_cost_usd_per_month": null,
      "max_concurrency": 1,
      "request_timeout_seconds": 1800,
      "max_retries": 0,
      "async_batch": {
        "supported": false,
        "reason": "A CLI OAuth subscription is not the xAI Batch API; isolated subprocesses are serialized."
      }
    },
    "claude_oauth": {
      "enabled": true,
      "transport": "claude_cli_oauth",
      "command": "claude",
      "auth": {
        "mode": "cli_oauth_keychain",
        "api_key_env": "ANTHROPIC_API_KEY"
      },
      "billing": "subscription",
      "allocated_subscription_cost_usd_per_month": null,
      "max_concurrency": 1,
      "request_timeout_seconds": 1800,
      "max_retries": 0,
      "async_batch": {
        "supported": false,
        "reason": "Claude Code OAuth is separate from the Anthropic Message Batches API; isolated subprocesses are serialized."
      }
    },
    "claude_host": {
      "enabled": true,
      "transport": "claude_host",
      "auth": {
        "mode": "host_owned"
      },
      "billing": "subscription_or_host_managed",
      "max_concurrency": 3,
      "async_batch": {
        "supported": false,
        "reason": "Native Claude subagents are host-owned; the plugin supplies presets rather than reusing host credentials."
      }
    }
  },
  "seats": {
    "all-grok-fuser": {
      "enabled": true,
      "provider": "xai_api",
      "model": "grok-4.5",
      "role": "fuser",
      "persona": "Grok generative fuser preserving supported dissent.",
      "reasoning": "xhigh",
      "effective_reasoning": "high",
      "reasoning_max_tokens": null,
      "max_output_tokens": 49152,
      "timeout_seconds": 1200,
      "tool_policy": "none",
      "structured_output": "final_answer"
    },
    "all-grok-judge": {
      "enabled": true,
      "provider": "xai_api",
      "model": "grok-4.5",
      "role": "judge",
      "persona": "Anonymous Grok comparative judge.",
      "reasoning": "xhigh",
      "effective_reasoning": "high",
      "reasoning_max_tokens": null,
      "max_output_tokens": 24576,
      "timeout_seconds": 1200,
      "tool_policy": "none",
      "structured_output": "judge_analysis"
    },
    "all-grok-panel-a": {
      "enabled": true,
      "provider": "xai_api",
      "model": "grok-4.5",
      "role": "panel",
      "persona": "Independent Grok implementation planner.",
      "reasoning": "xhigh",
      "effective_reasoning": "high",
      "reasoning_max_tokens": null,
      "max_output_tokens": 32768,
      "timeout_seconds": 1200,
      "tool_policy": "none",
      "structured_output": "panel_report"
    },
    "all-grok-panel-b": {
      "enabled": true,
      "provider": "xai_api",
      "model": "grok-4.5",
      "role": "panel",
      "persona": "Independent Grok adversarial falsifier.",
      "reasoning": "xhigh",
      "effective_reasoning": "high",
      "reasoning_max_tokens": null,
      "max_output_tokens": 32768,
      "timeout_seconds": 1200,
      "tool_policy": "none",
      "structured_output": "panel_report"
    },
    "fable5-oauth-fuser": {
      "enabled": true,
      "provider": "claude_oauth",
      "model": "claude-fable-5",
      "role": "fuser",
      "persona": "Subscription-backed generative fuser; synthesize the strongest plan while preserving supported dissent.",
      "reasoning": "xhigh",
      "effective_reasoning": "max",
      "reasoning_max_tokens": null,
      "max_output_tokens": 49152,
      "timeout_seconds": 1200,
      "tool_policy": "none",
      "structured_output": "final_answer"
    },
    "fable5-oauth-panel": {
      "enabled": true,
      "provider": "claude_oauth",
      "model": "claude-fable-5",
      "role": "panel",
      "persona": "Subscription-backed Fable panel seat in safe mode with tools disabled.",
      "reasoning": "xhigh",
      "effective_reasoning": "max",
      "reasoning_max_tokens": null,
      "max_output_tokens": 32768,
      "timeout_seconds": 1200,
      "tool_policy": "none",
      "structured_output": "panel_report"
    },
    "fable5-panel": {
      "enabled": true,
      "provider": "openrouter_api",
      "model": "anthropic/claude-fable-5",
      "role": "panel",
      "persona": "Independent conceptual critic; produce an alternative plan and identify hidden assumptions.",
      "reasoning": "xhigh",
      "effective_reasoning": "xhigh",
      "reasoning_max_tokens": null,
      "max_output_tokens": 32768,
      "timeout_seconds": 1200,
      "tool_policy": "none",
      "structured_output": "panel_report"
    },
    "gpt56sol-fuser": {
      "enabled": true,
      "provider": "openrouter_api",
      "model": "openai/gpt-5.6-sol",
      "role": "fuser",
      "persona": "Generative fuser; build a stronger answer from raw evidence and preserve supported dissent.",
      "reasoning": "xhigh",
      "effective_reasoning": "xhigh",
      "reasoning_max_tokens": null,
      "max_output_tokens": 49152,
      "timeout_seconds": 1200,
      "tool_policy": "none",
      "structured_output": "final_answer"
    },
    "gpt56sol-judge": {
      "enabled": true,
      "provider": "openrouter_api",
      "model": "openai/gpt-5.6-sol",
      "role": "judge",
      "persona": "Anonymous comparative judge; diagnose contradictions without majority voting.",
      "reasoning": "xhigh",
      "effective_reasoning": "xhigh",
      "reasoning_max_tokens": null,
      "max_output_tokens": 24576,
      "timeout_seconds": 1200,
      "tool_policy": "none",
      "structured_output": "judge_analysis"
    },
    "gpt56sol-panel": {
      "enabled": true,
      "provider": "openrouter_api",
      "model": "openai/gpt-5.6-sol",
      "role": "panel",
      "persona": "Independent systems and implementation planner; trace constraints and edge cases.",
      "reasoning": "xhigh",
      "effective_reasoning": "xhigh",
      "reasoning_max_tokens": null,
      "max_output_tokens": 32768,
      "timeout_seconds": 1200,
      "tool_policy": "none",
      "structured_output": "panel_report"
    },
    "grok45-gate-primary": {
      "enabled": true,
      "provider": "xai_api",
      "model": "grok-4.5",
      "role": "verifier",
      "persona": "Fail-closed approval reviewer; reject unsupported completion claims.",
      "reasoning": "xhigh",
      "effective_reasoning": "high",
      "reasoning_max_tokens": null,
      "max_output_tokens": 24576,
      "timeout_seconds": 1200,
      "tool_policy": "none",
      "structured_output": "gate_verdict"
    },
    "grok45-gate-secondary": {
      "enabled": true,
      "provider": "xai_api",
      "model": "grok-4.5",
      "role": "verifier",
      "persona": "Independent adversarial gate reviewer; seek counterexamples and missing evidence.",
      "reasoning": "xhigh",
      "effective_reasoning": "high",
      "reasoning_max_tokens": null,